<?xml version="1.0" encoding="UTF-8"?>
<npc_skill_templates xmlns:xsi="http://www.w3.org/2001/XMLSchema-instance" xsi:noNamespaceSchemaLocation="../npc_skills.xsd">
	<!-- Hyperion -->
	<npc_skills npc_ids="231073">
		<npc_skill id="21254" is_post_spawn="true" />
		<npc_skill id="21241" lv="56" prob="65" target="RANDOM_EXCEPT_CURRENT_TARGET" cd="120000"/>
		<npc_skill id="21241" lv="56" prob="65" cd="30000"/>
		<npc_skill id="21242" lv="56" prob="70" cd="8000" />
		<npc_skill id="21243" lv="56" prob="70" cd="8000" />
		<npc_skill id="21244" lv="56" prob="60" max_hp="80" cd="35000" />
		<npc_skill id="21245" lv="56" prob="60" min_hp="15" max_hp="75" cd="25000"/>
		<npc_skill id="21247" lv="56" prob="60" min_hp="50" max_hp="80" cd="30000"/>
		<npc_skill id="21247" lv="56" prob="50" min_hp="50" max_hp="80" cd="140000" target="RANDOM_EXCEPT_CURRENT_TARGET" />
		<npc_skill id="21248" lv="56" prob="50" min_hp="15" max_hp="45" cd="140000" target="RANDOM_EXCEPT_CURRENT_TARGET" />
		<npc_skill id="21248" lv="56" prob="60" min_hp="15" max_hp="45" cd="30000" />
		<npc_skill id="21249" lv="56" prob="50" max_hp="10" cd="140000" target="RANDOM_EXCEPT_CURRENT_TARGET"/>
		<npc_skill id="21249" lv="56" prob="60" max_hp="10" cd="30000"/>
		<npc_skill id="21250" lv="56" prob="70" min_hp="30" max_hp="75" chain_id="0" next_chain_id="1" next_skill_time="0" cd="55000" prio="2"/>
		<npc_skill id="21251" lv="56" prob="100" chain_id="1" />
		<npc_skill id="21250" lv="56" prob="70" max_hp="25" chain_id="0" next_chain_id="4" next_skill_time="0" cd="55000" prio="1"/>
		<npc_skill id="21252" lv="56" prob="100" chain_id="4"/>
	</npc_skills>
	<!-- Ide Forcefield Generator -->
	<npc_skills npc_ids="231074 231078 231082 231086">
		<npc_skill id="21371" lv="41" is_post_spawn="true" />
	</npc_skills>
	<!-- Agent Kabalash -->
	<npc_skills npc_ids="231075 231087">
		<npc_skill id="20700" lv="56" is_post_spawn="true"/>
		<npc_skill id="20701" lv="56" is_post_spawn="true"/>
		<npc_skill id="20712" lv="56" prob="70" cd="15000"/>
		<npc_skill id="17722" lv="56" prob="70" cd="10000"/>
		<npc_skill id="17335" lv="56" prob="70" cd="10000"/>
		<npc_skill id="20179" lv="10" prob="70" cd="15000"/> <!-- TODO change to lv="56" when new NpcStats and damage calculations are implemented -->
		<npc_skill id="21288" lv="56" prob="70" cd="10000"/>
		<npc_skill id="20711" lv="56" prob="70" cd="10000"/>
	</npc_skills>
	<!-- Hyperion Defense Elite Sniper -->
	<npc_skills npc_ids="231076 231077 231080 231088">
		<npc_skill id="20700" lv="56" is_post_spawn="true"/>
		<npc_skill id="17106" lv="56" prob="70" cd="20000"/>
		<npc_skill id="17318" lv="56" prob="70" cd="15000"/>
		<npc_skill id="17317" lv="56" prob="70" cd="8000"/>
		<npc_skill id="17314" lv="56" prob="70" cd="12000"/>
		<npc_skill id="21230" lv="56" prob="60"	cd="15000"/>
	</npc_skills>
	<!-- Hyperion Defense Elite Gunner -->
	<npc_skills npc_ids="231091">
		<npc_skill id="20700" lv="56" is_post_spawn="true"/>
		<npc_skill id="21292" lv="56" prob="80" cd="8000"/>
		<npc_skill id="21293" lv="56" prob="70" cd="15000"/>
	</npc_skills>
	<!-- Hyperion Defense Turret -->
	<npc_skills npc_ids="231102">
		<npc_skill id="16896" lv="56" prob="70" cd="15000" />
		<npc_skill id="17003" lv="56" prob="70" cd="15000" />
		<npc_skill id="21415" lv="56" prob="70" cd="15000" />
	</npc_skills>
	<!-- Ide Pool -->
	<npc_skills npc_ids="231104">
		<npc_skill id="21356" lv="56" prob="20" />
	</npc_skills>
	<!-- summoned ancient tyrhund -->
	<npc_skills npc_ids="231103">
		<npc_skill id="21300" lv="56" prob="80" cd="15000"/>
		<npc_skill id="20947" lv="56" prob="20" cd="25000"/>
	</npc_skills>
	<!-- hyperion defense combatant -->
	<npc_skills npc_ids="231096 231099 231084">
		<npc_skill id="20700" lv="56" is_post_spawn="true"/>
		<npc_skill id="17294" lv="56" prob="70" cd="8000"/>
		<npc_skill id="21284" lv="56" prob="70" cd="12000"/>
	</npc_skills>
	<!-- hyperion defense scout -->
	<npc_skills npc_ids="231097 231100">
		<npc_skill id="20700" lv="56" is_post_spawn="true"/>
		<npc_skill id="17322" lv="56" prob="70" cd="12000" next_chain_id="1" next_skill_time="0"/>
		<npc_skill id="16678" lv="56" prob="100" cd="8000" chain_id="1"/>
		<npc_skill id="17295" lv="56" prob="70" cd="8000"/>
	</npc_skills>
	<!-- hyperion defense medic -->
	<npc_skills npc_ids="231098 231101">
		<npc_skill id="20700" lv="56" is_post_spawn="true"/>
		<npc_skill id="17359" lv="56" prob="70" cd="7000"/>
		<npc_skill id="17360" lv="56" prob="70" cd="12000"/>
		<npc_skill id="17361" lv="56" prob="100" max_hp="60" cd="15000" prio="1"/>
	</npc_skills>
	<!-- hyperion defense elite sniper -->
	<npc_skills npc_ids="231089">
		<npc_skill id="20700" lv="56" is_post_spawn="true"/>
		<npc_skill id="17318" lv="56" prob="70" cd="8000"/>
		<npc_skill id="17106" lv="56" prob="60" cd="20000"/>
		<npc_skill id="17317" lv="56" prob="70" cd="8000"/>
		<npc_skill id="17314" lv="56" prob="70" cd="8000"/>
		<npc_skill id="21230" lv="56" prob="70" cd="9000"/>
	</npc_skills>
	<!-- Hyperion Defense Elite Assassin -->
	<npc_skills npc_ids="231079 231083">
		<npc_skill id="20700" lv="56" is_post_spawn="true"/>
		<npc_skill id="17321" lv="56" prob="80" cd="8000" chain_id="1"/>
		<npc_skill id="17332" lv="56" cd="8000" />
		<npc_skill id="21289" lv="56" prob="80" cd="10000"/>
		<npc_skill id="16452" lv="56" prob="100" cd="30000" next_chain_id="1" next_skill_time="0"/>
	</npc_skills>
	<!-- hyperion defense elite fighter -->
	<npc_skills npc_ids="231090">
		<npc_skill id="20700" lv="56" is_post_spawn="true"/>
		<npc_skill id="17295" lv="56" prob="80" cd="10000"/>
		<npc_skill id="17294" lv="56" prob="80" cd="6000"/>
	</npc_skills>
	<!-- hyperion defense elite medic -->
	<npc_skills npc_ids="231081 231085">
		<npc_skill id="20700" lv="56" is_post_spawn="true"/>
		<npc_skill id="17359" lv="56" prob="70" cd="8000"/>
		<npc_skill id="21278" lv="56" prob="70" cd="15000"/>
		<npc_skill id="17361" lv="56" prob="100" cd="15000" max_hp="60" prio="1"/>
		<npc_skill id="17700" lv="56" prob="70" cd="15000"/>
		<npc_skill id="16566" lv="56" prob="100" cd="10000" max_hp="80" prio="1"/>
	</npc_skills>
</npc_skill_templates>