<?xml version="1.0" encoding="UTF-8"?>
<npc_skill_templates xmlns:xsi="http://www.w3.org/2001/XMLSchema-instance" xsi:noNamespaceSchemaLocation="../npc_skills.xsd">
	<npc_skills npc_ids="219600"><!-- Laksyaka Legatus -->
		<npc_skill id="18166" lv="50" prob="18" />
		<npc_skill id="16785" lv="50" prob="36" />
		<npc_skill id="18164" lv="50" prob="9" />
		<npc_skill id="16608" lv="50" prob="9" />
		<npc_skill id="16519" lv="50" prob="27" />
	</npc_skills>
	<npc_skills npc_ids="219601"><!-- Laksyaka Magus -->
		<npc_skill id="18174" lv="50" prob="36" />
		<npc_skill id="17039" lv="50" prob="18" />
		<npc_skill id="16775" lv="50" prob="27" />
		<npc_skill id="18157" lv="50" prob="9" />
		<npc_skill id="18175" lv="50" prob="9" />
	</npc_skills>
	<npc_skills npc_ids="219602"><!-- Laksyaka Ambusher -->
		<npc_skill id="16608" lv="50" prob="18" />
		<npc_skill id="16540" lv="50" prob="18" />
		<npc_skill id="17934" lv="50" prob="18" />
		<npc_skill id="18159" lv="50" prob="29" />
		<npc_skill id="18158" lv="50" prob="12" />
		<npc_skill id="19125" lv="50" prob="6" />
	</npc_skills>
	<npc_skills npc_ids="219603"><!-- Laksyaka Sniper -->
		<npc_skill id="18173" lv="50" prob="25" />
		<npc_skill id="17003" lv="50" prob="25" />
	</npc_skills>
	<npc_skills npc_ids="219604"><!-- Laksyaka Officer -->
		<npc_skill id="17008" lv="50" prob="21" />
		<npc_skill id="16566" lv="50" prob="25" />
		<npc_skill id="16563" lv="50" prob="24" />
		<npc_skill id="16638" lv="50" prob="14" />
		<npc_skill id="16565" lv="50" prob="4" />
		<npc_skill id="16837" lv="50" prob="4" />
	</npc_skills>
	<npc_skills npc_ids="219605"><!-- Laksyaka Infantry -->
		<npc_skill id="17475" lv="54" prob="25" />
		<npc_skill id="17465" lv="54" prob="25" />
	</npc_skills>
	<npc_skills npc_ids="219606"><!-- Laksyaka Bladesworn -->
		<npc_skill id="17420" lv="54" prob="25" />
		<npc_skill id="17408" lv="54" prob="25" />
	</npc_skills>
	<npc_skills npc_ids="219607"><!-- Laksyaka Sentry -->
		<npc_skill id="17492" lv="54" prob="33" />
		<npc_skill id="17489" lv="54" prob="50" />
		<npc_skill id="17490" lv="54" prob="17" />
	</npc_skills>
	<npc_skills npc_ids="219608"><!-- Laksyaka Elite Medic -->
		<npc_skill id="17480" lv="54" prob="29" />
		<npc_skill id="16635" lv="54" prob="14" />
		<npc_skill id="17487" lv="54" prob="21" />
		<npc_skill id="17486" lv="54" prob="14" />
		<npc_skill id="16563" lv="54" prob="7" />
		<npc_skill id="17497" lv="54" prob="7" />
		<npc_skill id="17485" lv="54" prob="7" />
	</npc_skills>
	<npc_skills npc_ids="219609"><!-- Captain Jarka -->
		<npc_skill id="18166" lv="54" prob="29" />
		<npc_skill id="16608" lv="54" prob="29" />
		<npc_skill id="16519" lv="54" prob="29" />
		<npc_skill id="18165" lv="54" prob="14" />
	</npc_skills>
	<npc_skills npc_ids="286933 219610"><!-- Captain Lakhara (B3), Adjutant Galamat (B5) -->
		<npc_skill id="16608" lv="65" prob="75" cd="15000" />
		<npc_skill id="17497" lv="65" prob="75" cd="20000" />
		<npc_skill id="17485" lv="65" prob="50" cd="35000" />
		<npc_skill id="17039" lv="65" prob="30" cd="5000" next_skill_time="3000" target="RANDOM_EXCEPT_CURRENT_TARGET" />
		<npc_skill id="17480" lv="65" prob="60" cd="30000" target="RANDOM" />
	</npc_skills>
	<npc_skills npc_ids="219611 219614"><!-- Laksyaka Bladesworn (B1), Laksyaka Infantry (B6) -->
		<npc_skill id="17480" lv="65" prob="75" cd="6000" target="RANDOM_EXCEPT_CURRENT_TARGET" />
		<npc_skill id="17497" lv="65" prob="75" cd="15000" />
		<npc_skill id="18164" lv="65" prob="75" cd="10000" target="MOST_HATED" />
		<npc_skill id="18174" lv="65" prob="100" cd="20000" max_time="50000" min_time="30000" />
	</npc_skills>
	<npc_skills npc_ids="219612 219613"><!-- Laksyaka Infantry (B3), Laksyaka Infantry(B4) -->
		<npc_skill id="17480" lv="65" prob="75" cd="6000" target="RANDOM_EXCEPT_CURRENT_TARGET" />
		<npc_skill id="17497" lv="65" prob="75" cd="15000" />
		<npc_skill id="18164" lv="65" prob="75" cd="10000" target="MOST_HATED" />
		<npc_skill id="18174" lv="65" prob="100" cd="20000" max_time="50000" min_time="30000" />
	</npc_skills>
	<npc_skills npc_ids="219634"><!-- Laksyaka Legatus -->
		<npc_skill id="18166" lv="50" prob="30" />
		<npc_skill id="16785" lv="50" prob="40" />
		<npc_skill id="18164" lv="50" prob="20" />
		<npc_skill id="16608" lv="50" prob="10" />
	</npc_skills>
	<npc_skills npc_ids="219635"><!-- Laksyaka Magus -->
		<npc_skill id="18174" lv="50" prob="20" />
		<npc_skill id="16775" lv="50" prob="20" />
		<npc_skill id="17039" lv="50" prob="20" />
		<npc_skill id="16570" lv="50" prob="40" />
	</npc_skills>
	<npc_skills npc_ids="219637"><!-- Laksyaka Sniper -->
		<npc_skill id="18173" lv="50" prob="30" />
		<npc_skill id="16812" lv="50" prob="26" />
		<npc_skill id="16815" lv="50" prob="9" />
		<npc_skill id="17003" lv="50" prob="17" />
		<npc_skill id="16674" lv="50" prob="9" />
		<npc_skill id="18178" lv="50" prob="4" />
		<npc_skill id="16543" lv="50" prob="4" />
	</npc_skills>
	<npc_skills npc_ids="219638"><!-- Laksyaka Officer -->
		<npc_skill id="17008" lv="50" prob="21" />
		<npc_skill id="16566" lv="50" prob="25" />
		<npc_skill id="16563" lv="50" prob="32" />
		<npc_skill id="16638" lv="50" prob="14" />
		<npc_skill id="16565" lv="50" prob="4" />
		<npc_skill id="16837" lv="50" prob="4" />
	</npc_skills>
</npc_skill_templates>